{
  "name": "Showcase level 01",
  "scenes": [
    {
      "name": "Showcase Scene 01",
      "tags": ["current"]
    }
  ],
  "actors": [],
  "cameras": [
    {
      "fov": 45,
      "near": 1,
      "far": 10000,
      "position": { "x": 3, "y": 20, "z": 35 },
      "lookAt": { "x": 0, "y": 0, "z": 0 },
      "tags": ["initial"]
    }
  ],
  "lights": [
    {
      "type": "ambient",
      "color": "#ffffff",
      "intensity": 0.5,
      "castShadow": false,
      "position": { "x": 0.25, "y": 2, "z": 2.25 },
      "tags": []
    },
    {
      "type": "directional",
      "color": "#ffffff",
      "intensity": 1,
      "castShadow": true,
      "shadow": {
        "mapSize": { "x": 1024, "y": 1024 },
        "camera": { "far": 15 },
        "normalBias": 0.05
      },
      "position": { "x": 0.25, "y": 2, "z": 2.25 },
      "tags": []
    }
  ],
  "controls": [
    {
      "type": "OrbitControls",
      "cameraTag": "initial",
      "enableDamping": true,
      "tags": []
    }
  ],
  "tags": ["build-in"]
}
